{
    "product_id": "api_3da401c2-e5b2-4e1d-83bf-d994e49e9ffc",
    "tool_description": "Easy to use, low-priced QR code generator designed for speed and efficiency.",
    "home_url": "https://rapidapi.com/mikescogan-xbWFolmaQx/api/simple-qr-code-generator-cheap-and-efficient/",
    "name": "Simple QR Code Generator (Cheap and Efficient)",
    "title": "Simple QR Code Generator (Cheap and Efficient)",
    "pricing": "FREEMIUM",
    "tool_name": "Simple QR Code Generator (Cheap and Efficient)",
    "score": null,
    "host": "simple-qr-code-generator-cheap-and-efficient.p.rapidapi.com",
    "api_list": [
        {
            "name": "QR code generator GET endpoint",
            "url": "https://simple-qr-code-generator-cheap-and-efficient.p.rapidapi.com/api/v1/",
            "description": "Encodes your data into a QR code. Can pass any url or string into the \"data\" param. The \"data\" param is the only required field.\n\n## Query Params:\n- **data:** (REQUIRED) any url or string that you want the QR code to output when scanned. No hard limit applies to the length, however there is a soft limit of 10,000px image width/height. The longer your \"data\" string, the larger the QR code will become. If you are passing a very long string, try reducing the \"scale\" parameter.\n- **response-type:** (OPTIONAL) specifies whether you want the API to return an image or a [dataurl](https://developer.mozilla.org/en-US/docs/Web/HTTP/Basics_of_HTTP/Data_URLs). Default value: \"image\". Allowed values: \"image\", \"dataurl\"\n- **file-type:** (OPTIONAL) specifies the image format for the QR code. Default value: \"png\". Allowed values: \"png\", \"jpeg\", \"jpg\", \"svg\", \"pdf\"\n- **scale:** (OPTIONAL) specifies the relative size of the image. A larger number will give you a larger image. Default value: \"10\". Allowed values: 1-100.\n- **color:** (OPTIONAL) specifies the color of the QR code (the black part of a traditional QR code). Default value: \"#FFFFFF\" (black). Allowed values: Any valid HTML color.\n- **bg-color:** (OPTIONAL) specifies the background color of the QR code (the white part of a traditional QR code). Default value: \"#000000\" (white). Allowed values: Any valid HTML color.\n\n## Simple Example:\nGET https://simple-qr-code-generator-cheap-and-efficient.p.rapidapi.com/api/v1/?data=https://google.com\nThis will return a black and white QR code in png image format. Scanning the QR code will take the user to https://google.com\n\n## All Param Example:\nGET https://simple-qr-code-generator-cheap-and-efficient.p.rapidapi.com/api/v1/?data=https://google.com&response-type=dataurl&file-type=svg&scale=15&color=blue&bg-color=white\nThis will return a dataurl for a QR code in svg format that is blue and white. Scanning the QR code will take the user to https://google.com",
            "method": "GET",
            "required_parameters": [
                {
                    "name": "data",
                    "type": "STRING",
                    "description": "",
                    "default": "https://google.com"
                }
            ],
            "optional_parameters": [
                {
                    "name": "file-type",
                    "type": "STRING",
                    "description": "",
                    "default": "png"
                },
                {
                    "name": "scale",
                    "type": "STRING",
                    "description": "",
                    "default": "10"
                },
                {
                    "name": "response-type",
                    "type": "STRING",
                    "description": "",
                    "default": "image"
                },
                {
                    "name": "bg-color",
                    "type": "STRING",
                    "description": "",
                    "default": "#FFFFFF"
                },
                {
                    "name": "color",
                    "type": "STRING",
                    "description": "",
                    "default": "#000000"
                }
            ],
            "code": "import requests\n\nurl = \"https://simple-qr-code-generator-cheap-and-efficient.p.rapidapi.com/api/v1/\"\nquerystring = {\"file-type\": \"png\", \"data\": \"https://google.com\", \"scale\": \"10\", \"response-type\": \"image\", \"bg-color\": \"#FFFFFF\", \"color\": \"#000000\"}\n\nheaders = {\n            \"X-RapidAPI-Key\": \"SIGN-UP-FOR-KEY\",\n            \"X-RapidAPI-Host\": \"simple-qr-code-generator-cheap-and-efficient.p.rapidapi.com\"\n        }\n\nresponse = requests.get(url, headers=headers, params=querystring)\nprint(response.json())\n",
            "convert_code": "import requests\n\nurl = \"https://simple-qr-code-generator-cheap-and-efficient.p.rapidapi.com/api/v1/\"\nquerystring = {\"file-type\": \"png\", \"data\": \"https://google.com\", \"scale\": \"10\", \"response-type\": \"image\", \"bg-color\": \"#FFFFFF\", \"color\": \"#000000\"}\n\nheaders = {\n            \"X-RapidAPI-Key\": \"SIGN-UP-FOR-KEY\",\n            \"X-RapidAPI-Host\": \"simple-qr-code-generator-cheap-and-efficient.p.rapidapi.com\"\n        }\n\nresponse = requests.get(url, headers=headers, params=querystring)\nprint(response.json())\n",
            "test_endpoint": ""
        }
    ]
}